{
  "schema_version": "A16A_control_plane_event_v1",
  "event_id": "evt_fixture_valid",
  "session_id": "night_fixture_valid",
  "sequence": 1,
  "event_type": "SESSION_STARTED",
  "created_at": "2026-05-16T20:00:00.0000000Z",
  "mission_id": "",
  "source": "fixture",
  "payload": {
    "reason": "fixture"
  }
}
